{
  "schema_version": "0.4.0",
  "generated_at": "2026-08-08T09:00:00Z",
  "status": "drift",
  "declaration": {
    "path": ".claude/harness.json",
    "sha256": "9b0f6f1c2a3d4e5f60718293a4b5c6d7e8f9a0b1c2d3e4f5a6b7c8d9e0f1a2b3"
  },
  "checks": [
    {
      "id": "xcode",
      "kind": "tool",
      "status": "fail",
      "requirement": "16.4",
      "found": "16.2",
      "detail": "xcodebuild -version printed 'Xcode 16.2 / Build 16C5032a' via xcode-select path /Applications/Xcode.app",
      "remediation": "Install Xcode 16.4 and run xcode-select -s"
    },
    {
      "id": "swiftlint",
      "kind": "tool",
      "status": "pass",
      "requirement": ">=0.57",
      "found": "0.57.1"
    },
    {
      "id": "simulator",
      "kind": "resource",
      "status": "pass",
      "requirement": "an available iPhone simulator",
      "found": "iPhone 17 (iOS 27.0) [booted]"
    },
    {
      "id": "derived-data",
      "kind": "path",
      "status": "pass",
      "requirement": "writable",
      "found": "warm slot present"
    },
    {
      "id": "secrets",
      "kind": "file",
      "status": "warn",
      "requirement": "GeneratedSecrets.swift present",
      "detail": "missing \u2014 build precondition generates it --if-missing"
    },
    {
      "id": "xcresulttool",
      "kind": "tool",
      "status": "pass",
      "found": "xcresulttool version 23500"
    },
    {
      "id": "disk",
      "kind": "capacity",
      "status": "pass",
      "requirement": ">=20GB",
      "found": "142 GB free"
    }
  ],
  "machine_facts": [
    {
      "key": "sandbox_root",
      "status": "present",
      "source": "~/.claude/machine.json"
    }
  ],
  "summary": "Drift: Xcode 16.2 installed but declaration requires 16.4. Halting; route to a harness-update task (upgrade Xcode, or bump the declaration in the same commit as any code changes it requires). One advisory: generated secrets absent, will be provisioned by the verify precondition."
}